{
  "$schema": "http://json-schema.org/draft-07/schema#",
  "$id": "https://ecosystem.local/schema/ecosystem.schema.json",
  "title": "Ecosystem Pack Definition",
  "description": "Pack（エコシステムパック）の定義スキーマ。各Packは複数のComponentを含み、独立した機能セットを提供する。",
  "type": "object",
  "required": [
    "pack_id",
    "pack_identity",
    "version",
    "vocabulary"
  ],
  "properties": {
    "pack_id": {
      "type": "string",
      "description": "Pack の短縮識別子（ディレクトリ名として使用）",
      "pattern": "^[a-z][a-z0-9_-]*$",
      "minLength": 1,
      "maxLength": 64,
      "examples": [
        "default",
        "pro",
        "enterprise"
      ]
    },
    "pack_identity": {
      "type": "string",
      "description": "Pack のグローバル一意識別子。UUID生成の種となる。",
      "pattern": "^[a-z]+:.+$",
      "examples": [
        "github:haru/default-pack",
        "local:my-custom-pack"
      ]
    },
    "version": {
      "type": "string",
      "description": "セマンティックバージョニング",
      "pattern": "^\\d+\\.\\d+\\.\\d+(-[a-zA-Z0-9.]+)?(\\+[a-zA-Z0-9.]+)?$",
      "examples": [
        "1.0.0",
        "2.1.0-beta.1"
      ]
    },
    "pack_uuid": {
      "type": "string",
      "description": "pack_identityから生成されたUUID v5（読み込み時に自動計算される場合は省略可）",
      "format": "uuid"
    },
    "display_name": {
      "type": "string",
      "description": "UI表示用の名前",
      "maxLength": 128
    },
    "description": {
      "type": "string",
      "description": "Packの説明",
      "maxLength": 1024
    },
    "author": {
      "type": "object",
      "description": "作成者情報",
      "properties": {
        "name": {
          "type": "string",
          "maxLength": 128
        },
        "email": {
          "type": "string",
          "format": "email"
        },
        "url": {
          "type": "string",
          "format": "uri"
        }
      },
      "additionalProperties": false
    },
    "license": {
      "type": "string",
      "description": "ライセンス識別子（SPDX形式推奨）",
      "examples": [
        "MIT",
        "Apache-2.0",
        "proprietary"
      ]
    },
    "vocabulary": {
      "type": "object",
      "description": "このPackで使用可能なComponent typeの定義",
      "required": [
        "types"
      ],
      "properties": {
        "types": {
          "type": "array",
          "description": "許可されるComponent typeのリスト",
          "items": {
            "type": "string",
            "pattern": "^[a-z][a-z0-9_]*$"
          },
          "uniqueItems": true,
          "minItems": 1,
          "examples": [
            [
              "data_provider",
              "model_provider",
              "ui_surface",
              "workflow_provider",
              "capability_provider"
            ]
          ]
        },
        "custom_types": {
          "type": "object",
          "description": "カスタムtypeの詳細定義（将来拡張用）",
          "additionalProperties": {
            "type": "object",
            "properties": {
              "description": {
                "type": "string"
              },
              "singleton": {
                "type": "boolean",
                "default": false
              }
            },
            "additionalProperties": false
          }
        }
      },
      "additionalProperties": false
    },
    "dependencies": {
      "type": "object",
      "description": "他のPackへの依存関係",
      "additionalProperties": {
        "type": "string",
        "description": "依存するPackのバージョン範囲",
        "examples": [
          ">=1.0.0",
          "^2.0.0",
          "1.x"
        ]
      }
    },
    "metadata": {
      "type": "object",
      "description": "追加のメタデータ（自由形式）",
      "additionalProperties": true
    },
    "capability_bindings": {
      "type": "object",
      "description": "Capability Graph binding registration metadata. Community pack registration runs in the host process and requires host_execution approval.",
      "properties": {
        "register": {
          "type": "string",
          "description": "Pack-owned Python register function path"
        }
      },
      "required": [
        "register"
      ],
      "additionalProperties": false
    },
    "capabilities": {
      "type": "array",
      "description": "Pack-level capabilities requested by this Pack.",
      "items": {
        "type": "string"
      },
      "uniqueItems": true
    },
    "desktop_app": {
      "type": "object",
      "description": "Pack desktop app launch metadata.",
      "required": [
        "command"
      ],
      "properties": {
        "command": {
          "type": "string",
          "minLength": 1
        },
        "working_dir": {
          "type": "string"
        },
        "env": {
          "type": "object",
          "additionalProperties": {
            "type": "string"
          }
        },
        "capabilities": {
          "type": "array",
          "items": {
            "type": "string"
          }
        },
        "window": {
          "type": "object",
          "properties": {
            "title": {
              "type": "string"
            },
            "width": {
              "type": "integer"
            },
            "height": {
              "type": "integer"
            },
            "icon": {
              "type": "string"
            }
          },
          "additionalProperties": true
        },
        "platforms": {
          "type": "array",
          "items": {
            "type": "string",
            "enum": [
              "darwin",
              "win32",
              "linux"
            ]
          }
        }
      },
      "additionalProperties": false
    },
    "components": {
      "type": "object",
      "description": "Pack内のComponentの定義マップ。キーはComponent識別子。",
      "additionalProperties": {
        "type": "object",
        "description": "個別のComponent定義",
        "required": [
          "type",
          "id"
        ],
        "properties": {
          "type": {
            "type": "string",
            "description": "Componentのtype（vocabularyで定義されたもの）"
          },
          "id": {
            "type": "string",
            "description": "Component識別子"
          },
          "version": {
            "type": "string",
            "description": "Componentバージョン"
          },
          "path": {
            "type": "string",
            "description": "Componentのディレクトリパス"
          },
          "connectivity": {
            "type": "object",
            "description": "Componentの接続情報",
            "properties": {
              "provides": {
                "type": "array",
                "items": {
                  "type": "string",
                  "pattern": "^[a-z][a-z0-9_]*(\\.[a-z][a-z0-9_]*)*$"
                },
                "description": "このComponentが提供するインターフェース"
              },
              "requires": {
                "type": "array",
                "items": {
                  "type": "string",
                  "pattern": "^[a-z][a-z0-9_]*(\\.[a-z][a-z0-9_]*)*$"
                },
                "description": "このComponentが要求するインターフェース"
              }
            },
            "additionalProperties": false
          }
        },
        "additionalProperties": true
      }
    },
    "load_order": {
      "type": "array",
      "description": "Componentの読み込み順序。指定された順にComponentが初期化される。",
      "items": {
        "type": "string",
        "description": "Component識別子（type:id 形式）"
      }
    },
    "connectivity": {
      "type": "object",
      "description": "Pack レベルの接続性定義（provides/requires）",
      "properties": {
        "provides": {
          "type": "array",
          "items": {
            "type": "string"
          }
        },
        "requires": {
          "type": "array",
          "items": {
            "type": "string"
          }
        }
      },
      "additionalProperties": false
    },
    "required_secrets": {
      "type": "array",
      "description": "Pack が必要とするシークレットキーのリスト",
      "items": {
        "type": "string"
      }
    },
    "required_network": {
      "description": "Pack が必要とするネットワークアクセス先のリスト",
      "oneOf": [
        {
          "type": "array",
          "items": {
            "type": "string"
          }
        },
        {
          "type": "object",
          "properties": {
            "allowed_domains": {
              "type": "array",
              "items": {
                "type": "string"
              }
            },
            "allowed_ports": {
              "type": "array",
              "items": {
                "type": "integer",
                "minimum": 1,
                "maximum": 65535
              }
            }
          },
          "required": [
            "allowed_domains",
            "allowed_ports"
          ],
          "additionalProperties": false
        }
      ]
    },
    "host_execution": {
      "type": "boolean",
      "description": "true の場合、Docker 隔離なしでホスト上で直接実行される",
      "default": false
    },
    "stores": {
      "type": "array",
      "description": "Pack が宣言する Store 定義のリスト",
      "items": {
        "type": "object"
      }
    },
    "functions": {
      "type": "object",
      "description": "Pack が公開する関数定義",
      "additionalProperties": true
    },
    "web_mount": {
      "type": "object",
      "description": "Pack が提供する静的 Web UI のマウント定義",
      "properties": {
        "path_prefix": {
          "type": "string",
          "description": "URL パスプレフィックス (例: /panel, /setup)",
          "pattern": "^/[a-zA-Z0-9_-]+$"
        },
        "static_root": {
          "type": "string",
          "description": "静的ファイルのルートディレクトリ (Pack subdir からの相対パス)",
          "pattern": "^(?![\\\\/])(?!.*(?:^|[\\\\/])\\.\\.(?:[\\\\/]|$))[a-zA-Z0-9_./\\\\-]+$"
        },
        "spa_fallback": {
          "type": "boolean",
          "description": "拡張子なしのパスを index.html にフォールバックするか",
          "default": false
        },
        "auth_required": {
          "type": "boolean",
          "description": "静的ファイルへのアクセスに認証が必要か",
          "default": true
        }
      },
      "required": [
        "path_prefix",
        "static_root"
      ],
      "additionalProperties": false
    },
    "pre_auth_routes": {
      "type": "array",
      "description": "認証なしでアクセスを許可する API ルートの定義リスト",
      "items": {
        "type": "object",
        "properties": {
          "method": {
            "type": "string",
            "description": "HTTP メソッド (GET, POST, PUT, DELETE)",
            "enum": [
              "GET",
              "POST",
              "PUT",
              "DELETE"
            ]
          },
          "path": {
            "type": "string",
            "description": "完全一致するパス"
          },
          "path_prefix": {
            "type": "string",
            "description": "プレフィックス一致するパス"
          }
        },
        "required": [
          "method"
        ],
        "additionalProperties": false
      }
    },
    "api_routes": {
      "type": "array",
      "description": "Pack が宣言する API ルート定義のリスト",
      "items": {
        "type": "object",
        "additionalProperties": true
      }
    },
    "runtime": {
      "type": "object",
      "description": "Pack のランタイム環境を宣言的に指定する。未指定の場合は既存ロジック（core_ 接頭辞判定等）で決定される。",
      "properties": {
        "type": {
          "type": "string",
          "description": "実行方式。FunctionEntry の calling_convention に対応する。",
          "enum": [
            "python_host",
            "python_docker",
            "declarative_pack",
            "declarative_setup_pack",
            "binary",
            "command",
            "wasm"
          ]
        },
        "language": {
          "type": "string",
          "description": "開発言語（情報用。実行には影響しない）。",
          "examples": [
            "python",
            "rust",
            "go",
            "nodejs",
            "c",
            "cpp"
          ]
        },
        "protocol": {
          "type": "string",
          "description": "通信プロトコル。現時点では stdio_json のみ。",
          "enum": [
            "stdio_json"
          ],
          "default": "stdio_json"
        },
        "docker": {
          "type": "object",
          "description": "Docker 環境の設定",
          "properties": {
            "image": {
              "type": "string",
              "description": "Docker イメージ名 (例: python:3.11-slim)"
            },
            "build_command": {
              "type": [
                "string",
                "null"
              ],
              "description": "ビルドコマンド（将来拡張用）"
            },
            "network": {
              "type": "boolean",
              "description": "コンテナにネットワークアクセスを許可するか",
              "default": false
            }
          },
          "additionalProperties": false
        },
        "host_requirements": {
          "type": "object",
          "description": "ホスト環境の要求",
          "properties": {
            "min_memory_mb": {
              "type": [
                "integer",
                "null"
              ],
              "description": "最小メモリ要求 (MB)"
            },
            "gpu": {
              "type": "boolean",
              "description": "GPU が必要か",
              "default": false
            }
          },
          "additionalProperties": false
        }
      },
      "additionalProperties": false
    }
  },
  "additionalProperties": false
}
