{
  "components": {},
  "dependencies": {
    "defaultspack": ">=2.0.0"
  },
  "description": "Declarative PM, subagent assignment, branch ledger, and one-pack-one-PR governance pack.",
  "display_name": "Rumi Subagent PR Manager Pack",
  "load_order": [],
  "metadata": {
    "asset_index": {
      "catalog": [
        "catalog/subagent_pr_workflows.yaml",
        "catalog/subagent_routing_matrix.yaml",
        "catalog/pr_acceptance_rubric.yaml"
      ],
      "checklist": [
        "checklists/reviewer_handoff.checklist.yaml"
      ],
      "docs": [
        "docs/README.md",
        "docs/architecture.md",
        "docs/interfaces.md",
        "docs/operations.md"
      ],
      "example": [
        "examples/one_pr_per_subagent.example.yaml",
        "examples/merge_readiness_board.example.yaml",
        "examples/review_handoff.example.yaml"
      ],
      "ledger": [
        "ledgers/pr_evidence_ledger.schema.yaml"
      ],
      "policy": [
        "policies/subagent_pr_governance.policy.yaml"
      ],
      "presets": [
        "presets/safe_default.preset.yaml",
        "presets/handoff_review.preset.yaml",
        "presets/quality_gate.preset.yaml"
      ],
      "profiles": [
        "profiles/subagent_pr_manager.profile.yaml"
      ],
      "prompts": [
        "prompts/subagent_pr_manager.system.md"
      ],
      "readme": [
        "README.md"
      ],
      "spec": [],
      "template": [
        "templates/subagent_assignment_brief.template.yaml"
      ]
    },
    "declarative_only": true,
    "executable_code": false,
    "network_policy": "none_by_default",
    "optional_integrations": [
      {
        "pack_id": "rumi_agent_services_pack",
        "reason": "Agent execution and background coordination are owned by agent services; this pack only routes and records PR governance decisions."
      },
      {
        "pack_id": "rumi_code_ide_pack",
        "reason": "Code edits and conflict resolution are delegated to code/IDE owners; this pack preserves assignment and review evidence."
      },
      {
        "pack_id": "rumi_observability_pack",
        "reason": "Run metrics and durable telemetry are delegated to observability; this pack records the requested ledger shape."
      },
      {
        "pack_id": "rumi_pack_suite_pack",
        "reason": "Suite selection and release bundling are delegated to suite owners; this pack governs one-pack-one-PR readiness."
      }
    ],
    "owner_surfaces": [
      "subagent_assignment",
      "branch_pr_ledger",
      "merge_readiness",
      "pm_handoff",
      "subagent_routing_matrix",
      "pr_acceptance_rubric",
      "evidence_ledger",
      "handoff_checklist",
      "assignment_brief_template"
    ],
    "required_secrets": []
  },
  "pack_id": "rumi_subagent_pr_manager_pack",
  "pack_identity": "rumi:ecosystem/rumi_subagent_pr_manager_pack",
  "version": "0.1.0",
  "vocabulary": {
    "types": [
      "governance",
      "catalog",
      "policy",
      "profile",
      "prompt",
      "preset",
      "example",
      "checklist",
      "ledger",
      "template"
    ]
  }
}
