{
  "pack_id": "rumi_prompt_studio_pack",
  "pack_identity": "rumi:ecosystem/rumi_prompt_studio_pack",
  "display_name": "Rumi Prompt Studio Pack",
  "version": "0.1.0",
  "description": "Declarative prompt library, prompt linting, custom instruction migration, and fixture dry-run contract pack.",
  "vocabulary": {
    "types": [
      "catalog",
      "schema",
      "policy",
      "checklist",
      "ledger",
      "template",
      "profile",
      "prompt",
      "preset",
      "example"
    ]
  },
  "dependencies": {
    "defaultspack": ">=2.0.0"
  },
  "components": {},
  "load_order": [],
  "required_secrets": [],
  "required_network": [],
  "host_execution": false,
  "metadata": {
    "required_secrets": [],
    "network_policy": "none_by_default",
    "executable_code": false,
    "declarative_only": true,
    "optional_integrations": [
      {
        "pack_id": "rumi_model_evals_pack",
        "reason": "Adjacent owner for rumi_model_evals_pack handoff; this pack keeps declarative evidence only."
      },
      {
        "pack_id": "rumi_memory_knowledge_pack",
        "reason": "Adjacent owner for rumi_memory_knowledge_pack handoff; this pack keeps declarative evidence only."
      },
      {
        "pack_id": "rumi_code_ide_pack",
        "reason": "Adjacent owner for rumi_code_ide_pack handoff; this pack keeps declarative evidence only."
      },
      {
        "pack_id": "rumi_knowledge_marketplace_pack",
        "reason": "Adjacent owner for rumi_knowledge_marketplace_pack handoff; this pack keeps declarative evidence only."
      }
    ],
    "owner_surfaces": [
      "prompt_artifact_catalog",
      "prompt_lint_rubric",
      "custom_instruction_migration",
      "fixture_dry_run_contract",
      "prompt_version_ledger"
    ],
    "asset_index": {
      "readme": [
        "README.md"
      ],
      "docs": [
        "docs/README.md",
        "docs/architecture.md",
        "docs/interfaces.md",
        "docs/operations.md"
      ],
      "catalog": [
        "catalog/prompt_studio_prompt_library.yaml",
        "catalog/prompt_studio_workflows.yaml",
        "catalog/prompt_studio_quality_matrix.yaml",
        "catalog/custom_instruction_migration_map.yaml",
        "catalog/provider_migration_matrix.yaml"
      ],
      "schema": [
        "schemas/prompt_studio_record.schema.json"
      ],
      "policy": [
        "policies/prompt_studio_safety.policy.yaml",
        "policies/provider_style_boundary.policy.yaml"
      ],
      "checklist": [
        "checklists/prompt_studio_review.checklist.yaml"
      ],
      "ledger": [
        "ledgers/prompt_studio_evidence_ledger.schema.yaml",
        "ledgers/prompt_version_ledger.yaml"
      ],
      "template": [
        "templates/prompt_studio_handoff.template.md",
        "templates/custom_instruction_migration.template.md"
      ],
      "profiles": [
        "profiles/prompt_editor.profile.yaml"
      ],
      "prompts": [
        "prompts/prompt_linter.system.md"
      ],
      "presets": [
        "presets/safe_default.preset.yaml",
        "presets/handoff_review.preset.yaml",
        "presets/quality_gate.preset.yaml"
      ],
      "example": [
        "examples/claude_style_instruction_migration.example.yaml",
        "examples/chatgpt_custom_instruction_lint.example.yaml",
        "examples/gemini_gem_prompt_normalization.example.yaml"
      ],
      "fixtures": [
        "fixtures/prompt_regression_cases.yaml"
      ]
    }
  }
}
